{
  "schema_version": 1,
  "event_id": "EVT-01K0W4Z36K3W5C2R0A3M8N9P82",
  "task_id": "TASK-01K0W4Z36K3W5C2R0A3M8N9P7Q-refund-auth",
  "event_type": "scope_proposed",
  "occurred_at": "2026-07-17T10:01:00Z",
  "actor": {
    "id": "agent-main",
    "kind": "agent",
    "display_name": "Main Controller"
  },
  "run_id": null,
  "expected_revision": 0,
  "new_revision": 1,
  "idempotency_key": "example-1",
  "payload": {
    "scope_id": "SCOPE-01K0W4Z36K3W5C2R0A3M8N9P7R"
  }
}
