{
  "actor": {
    "id": "platform-owner",
    "kind": "human"
  },
  "event_id": "EVT-01KXXHSZWDT3DPFH8SBDZ1D5ET",
  "event_type": "work_unit_created",
  "expected_revision": 9,
  "idempotency_key": "alpha-wu-core-create",
  "new_revision": 10,
  "occurred_at": "2026-07-19T16:02:05.837540Z",
  "payload": {
    "work_unit": {
      "acceptance_criteria": [],
      "allowed_paths": [
        "src/mac/policy.py",
        "src/mac/state_machine.py",
        "src/mac/events.py",
        "src/mac/authority.py",
        "src/mac/evidence.py",
        "src/mac/repository.py",
        "src/mac/result.py",
        "src/mac/application/governance.py",
        "src/mac/application/close.py",
        "src/mac/application/task_service.py",
        "src/mac/application/evidence_service.py",
        "src/mac/ports/system.py",
        "src/mac/ports/task_repository.py",
        "src/mac/ports/git_repository.py",
        "src/mac/adapters/filesystem/repository.py",
        "tests/test_policy.py",
        "tests/test_state_machine.py",
        "tests/test_event_store.py",
        "tests/test_event_projection_variants.py",
        "tests/test_evidence_lifecycle.py",
        "tests/test_result_intake.py",
        "tests/security/test_authority_commands.py",
        "tests/security/test_close_fail_closed.py",
        "tests/security/test_event_revision_security.py",
        "tests/security/test_evidence_tampering.py",
        "tests/review/test_independence.py",
        "tests/risk/test_risk_acceptance.py"
      ],
      "depends_on": [],
      "expected_result": "tasks/TASK-01KXXHKS63XE2A30229824FX0N-v6-alpha-pilot-ready/results/RESULT-01KXXHSZRPJ5YKMQ9MCQHQZH12.json",
      "id": "WU-01KXXHSZRPJ5YKMQ9MCQHQZH11",
      "owner": "platform",
      "schema_version": 1,
      "status": "pending",
      "task_id": "TASK-01KXXHKS63XE2A30229824FX0N-v6-alpha-pilot-ready",
      "title": "Frozen Policy、Task Journal 与 Evidence/Close"
    },
    "work_unit_id": "WU-01KXXHSZRPJ5YKMQ9MCQHQZH11"
  },
  "run_id": null,
  "schema_version": 1,
  "task_id": "TASK-01KXXHKS63XE2A30229824FX0N-v6-alpha-pilot-ready"
}
