{
  "actor": {
    "id": "repo-owner",
    "kind": "human"
  },
  "event_id": "EVT-01KXXNE097WGW4FRXXS3HC1548",
  "event_type": "scope_proposed",
  "expected_revision": 23,
  "idempotency_key": "scope-amend-v3-cli-tests",
  "new_revision": 24,
  "occurred_at": "2026-07-19T17:05:27.335054Z",
  "payload": {
    "amendment": true,
    "scope": {
      "allowed_operations": [
        "read",
        "write",
        "execute_tests",
        "generate_artifacts"
      ],
      "allowed_paths": [
        "src/mac/policy.py",
        "src/mac/state_machine.py",
        "src/mac/events.py",
        "src/mac/authority.py",
        "src/mac/security.py",
        "src/mac/io.py",
        "src/mac/ownership.py",
        "src/mac/scope.py",
        "src/mac/git.py",
        "src/mac/evidence.py",
        "src/mac/repository.py",
        "src/mac/result.py",
        "src/mac/migration.py",
        "src/mac/doctor.py",
        "src/mac/report.py",
        "src/mac/schema_validation.py",
        "src/mac/cli.py",
        "src/mac/application/governance.py",
        "src/mac/application/close.py",
        "src/mac/application/task_service.py",
        "src/mac/application/evidence_service.py",
        "src/mac/ports/system.py",
        "src/mac/ports/task_repository.py",
        "src/mac/ports/git_repository.py",
        "src/mac/adapters/filesystem/repository.py",
        "src/mac/adapters/runtime/plain_terminal.py",
        "migration/migrate_v5.py",
        "scripts/ci/governance_pr.py",
        "scripts/release/check_release_version.py",
        "scripts/release/check_schema_lock.py",
        ".github/workflows/ci.yml",
        ".github/workflows/governance-pr.yml",
        ".github/workflows/release.yml",
        "pyproject.toml",
        "examples/v6/.github/workflows/multi-agent-governance.yml",
        "examples/v6/tasks/TASK-01K0W4Z36K3W5C2R0A3M8N9P7Q-refund-auth/**",
        "tests/test_policy.py",
        "tests/test_state_machine.py",
        "tests/test_event_store.py",
        "tests/test_event_projection_variants.py",
        "tests/test_evidence_lifecycle.py",
        "tests/test_scope_and_git.py",
        "tests/test_migration_and_services.py",
        "tests/test_result_intake.py",
        "tests/test_examples_v6.py",
        "tests/test_schema_validation.py",
        "tests/security/test_authority_commands.py",
        "tests/security/test_input_and_result_security.py",
        "tests/security/test_scope_threat_corpus.py",
        "tests/security/test_close_fail_closed.py",
        "tests/security/test_event_revision_security.py",
        "tests/security/test_evidence_tampering.py",
        "tests/review/test_independence.py",
        "tests/risk/test_risk_acceptance.py",
        "tests/adapters/test_plain_terminal.py",
        "tests/operations/test_doctor.py",
        "tests/operations/test_governance_pr.py",
        "tests/operations/test_release_artifacts.py",
        "tests/reporting/test_audit_bundle.py",
        "docs/pilot/alpha-close-report.md",
        "tasks/TASK-01KXXHKS63XE2A30229824FX0N-v6-alpha-pilot-ready/**",
        "tasks/private/TASK-01KXXHKS63XE2A30229824FX0N-v6-alpha-pilot-ready/**",
        "tests/test_repair_round3.py",
        "tests/test_repair_round4.py",
        "tests/test_cli_integration.py"
      ],
      "amendment_policy": {
        "max_amendments": 2,
        "max_paths_per_amendment": 4,
        "require_independent_approval_for": [
          "auth_security",
          "production_deploy"
        ]
      },
      "approved_by": [],
      "base_commit": "4bcc6bb27302b6c7ba6944ad7ceea3bbede96ffd",
      "denied_paths": [
        "AGENTS.md",
        ".agents/**",
        "schemas/**",
        "tasks/index.yaml",
        "tasks/TASK-0001-example/**",
        "tasks/TASK-0002-token-optimization/**",
        "tasks/TASK-0003-flow-performance/**",
        "tasks/TASK-0004-fresh-repair-context/**",
        "tasks/TASK-0005-unified-task-archive/**",
        "tasks/TASK-0006-v6-governance-core/**",
        "tasks/TASK-01KXXHD9Y5KFDWQ1Q3Q5345SBH-v6-alpha-pilot-ready/**",
        "docs/pilot/gate-2-report.md",
        "docs/pilot/gate-3-report.md",
        "multi-agent-collab-v6-design-package/**",
        "multi-agent-collab-deep-feasibility-plan-v3.md",
        ".idea/**",
        ".venv/**",
        ".pytest_cache/**",
        ".coverage",
        "dist/**",
        "tmp/**"
      ],
      "id": "SCOPE-01KXXHKS63XE2A30229824FX0P",
      "network_access": "none",
      "owners": [
        "governance",
        "platform",
        "security",
        "devex",
        "migration",
        "docs",
        "examples",
        "tests"
      ],
      "proposed_by": "repo-owner",
      "required_gates": [
        "approved_scope",
        "targeted_tests",
        "negative_security_tests",
        "secret_scan",
        "scope_guard",
        "compatibility_review",
        "data_integrity",
        "independent_review",
        "rollback_plan",
        "rollback_verification",
        "evidence_matches_current_commit"
      ],
      "risk_tags": [
        "auth_security",
        "data_migration",
        "policy_change",
        "production_deploy",
        "public_contract"
      ],
      "schema_version": 1,
      "secret_access": [],
      "status": "proposed",
      "task_id": "TASK-01KXXHKS63XE2A30229824FX0N-v6-alpha-pilot-ready",
      "version": 3
    },
    "scope_id": "SCOPE-01KXXHKS63XE2A30229824FX0P",
    "version": 3
  },
  "run_id": null,
  "schema_version": 1,
  "task_id": "TASK-01KXXHKS63XE2A30229824FX0N-v6-alpha-pilot-ready"
}
