{
  "actor": {
    "id": "security-owner",
    "kind": "human"
  },
  "event_id": "EVT-01KXXHRSA7RF02ZC7ZG3ZPTWW9",
  "event_type": "scope_approved",
  "expected_revision": 5,
  "idempotency_key": "alpha-scope-approval-security",
  "new_revision": 6,
  "occurred_at": "2026-07-19T16:01:26.343241Z",
  "payload": {
    "approval": {
      "actor": {
        "id": "security-owner",
        "kind": "human"
      },
      "decision": "approved",
      "id": "APR-01KXXHRS3AW43RHBPZE1V08X9S",
      "independence_level": "L2",
      "kind": "scope",
      "recorded_at": "2026-07-19T16:01:26.122090Z",
      "schema_version": 1,
      "subject_ref": "tasks/TASK-01KXXHKS63XE2A30229824FX0N-v6-alpha-pilot-ready/scope-contract.yaml",
      "task_id": "TASK-01KXXHKS63XE2A30229824FX0N-v6-alpha-pilot-ready"
    },
    "approval_id": "APR-01KXXHRS3AW43RHBPZE1V08X9S",
    "approval_kind": "scope"
  },
  "run_id": null,
  "schema_version": 1,
  "task_id": "TASK-01KXXHKS63XE2A30229824FX0N-v6-alpha-pilot-ready"
}
