{
  "actor": {
    "id": "repo-owner",
    "kind": "human"
  },
  "event_id": "EVT-01KXXHKSC6ZM71PSYGXZ50EKEN",
  "event_type": "task_created",
  "expected_revision": -1,
  "idempotency_key": "alpha-close-isolated-20260719-create-v2",
  "new_revision": 0,
  "occurred_at": "2026-07-19T15:58:42.566573Z",
  "payload": {
    "task": {
      "acceptance_criteria": [
        {
          "id": "AC-001",
          "required": true,
          "text": "逐项复现 RV6-001..017；仍存在项修复，不可复现项有增强回归证据，blocking finding 为零"
        },
        {
          "id": "AC-002",
          "required": true,
          "text": "Policy/Authority、事务写入、Evidence/Close 与 Adapter seam 由单一一致接口驱动并 fail closed"
        },
        {
          "id": "AC-003",
          "required": true,
          "text": "根仓库、tracked examples/v6、迁移 replay、dirty/index workspace Evidence、路径安全和发布验证通过"
        },
        {
          "id": "AC-004",
          "required": true,
          "text": "不同运行时、只读、无实现参与的 L2 Reviewer 固定 commit/diff/policy 后批准"
        },
        {
          "id": "AC-005",
          "required": true,
          "text": "真实三项目 Pilot、托管 CI 和正式发布继续标记 waiting_external，不伪造通过"
        }
      ],
      "active_controller": null,
      "created_at": "2026-07-19T15:58:42.371760Z",
      "id": "TASK-01KXXHKS63XE2A30229824FX0N-v6-alpha-pilot-ready",
      "legacy_integrity": "full",
      "mode": "high_risk",
      "objective": "作为 TASK-0006-v6-governance-core 的正式 successor，关闭仍可复现的 RV6 阻断并取得 Pilot-ready 证据",
      "ownership_ref": {
        "combined_digest": "sha256:8322c80c33ba3a9dc3ca556c1730f7ab31f600127b015dc694646e96d4309ada",
        "files": [
          {
            "digest": "sha256:4310b82a349bb47e87b2355d9b7ef1220a84ae6ea4d15b70c55b6564a72c7e31",
            "path": ".agents/ownership.yaml"
          }
        ],
        "source_commit": "4bcc6bb27302b6c7ba6944ad7ceea3bbede96ffd"
      },
      "policy_ref": {
        "combined_digest": "sha256:3096c41375683cb941d611affac8f130392048b6044430e3e043d91249336e1f",
        "files": [
          {
            "digest": "sha256:562f78b04e020a2e2f315c355150bb3f9ddcf506f4f21a94b901f66eae5c0432",
            "path": ".agents/config.yaml"
          },
          {
            "digest": "sha256:3534a269993883136842880a8236a4c168f815739c03b431a3864def65e4dbaf",
            "path": ".agents/workflows/evidence-driven-development.yaml"
          },
          {
            "digest": "sha256:67c277a9d9da74f01ee7558a8190148b17b22720e9c6db310128b266c448a506",
            "path": "AGENTS.md"
          }
        ],
        "source_commit": "4bcc6bb27302b6c7ba6944ad7ceea3bbede96ffd"
      },
      "relationships": {
        "parent_task": "TASK-0006-v6-governance-core",
        "superseded_by": null,
        "supersedes": [
          "TASK-0006-v6-governance-core"
        ]
      },
      "required_gates": [
        "approved_scope",
        "targeted_tests",
        "negative_security_tests",
        "secret_scan",
        "scope_guard",
        "compatibility_review",
        "data_integrity",
        "independent_review",
        "rollback_plan",
        "rollback_verification",
        "evidence_matches_current_commit"
      ],
      "revision": 0,
      "runtime_profile": "local-multi",
      "schema_version": 6,
      "scope_contract_ref": "tasks/TASK-01KXXHKS63XE2A30229824FX0N-v6-alpha-pilot-ready/scope-contract.yaml",
      "state": "triage",
      "terminal": null,
      "title": "v6 Alpha 收口与 Pilot-ready",
      "updated_at": "2026-07-19T15:58:42.371760Z"
    }
  },
  "run_id": null,
  "schema_version": 1,
  "task_id": "TASK-01KXXHKS63XE2A30229824FX0N-v6-alpha-pilot-ready"
}
