{
  "actor": {
    "id": "edge-implementer",
    "kind": "human"
  },
  "event_id": "EVT-01KXXHVSRS3Y552RRWHV2ET95T",
  "event_type": "run_started",
  "expected_revision": 17,
  "idempotency_key": "alpha-run-edge-register",
  "new_revision": 18,
  "occurred_at": "2026-07-19T16:03:05.113641Z",
  "payload": {
    "run": {
      "actor": {
        "id": "edge-implementer",
        "kind": "agent"
      },
      "exit_code": null,
      "finished_at": null,
      "id": "RUN-01KXXHVSJXA7X1PRGWJBKP35BC",
      "independence_level": "L0",
      "runtime": {
        "execution_context_id": "edge-blocker-impl-20260719",
        "profile": "local-multi"
      },
      "schema_version": 1,
      "started_at": "2026-07-19T16:03:04.925122Z",
      "status": "running",
      "task_id": "TASK-01KXXHKS63XE2A30229824FX0N-v6-alpha-pilot-ready",
      "work_unit_id": "WU-01KXXHTEMXPCT29MAV3AFAMWFH"
    },
    "run_id": "RUN-01KXXHVSJXA7X1PRGWJBKP35BC",
    "work_unit": {
      "acceptance_criteria": [],
      "allowed_paths": [
        "src/mac/security.py",
        "src/mac/io.py",
        "src/mac/ownership.py",
        "src/mac/scope.py",
        "src/mac/git.py",
        "src/mac/migration.py",
        "migration/migrate_v5.py",
        "examples/v6/.github/workflows/multi-agent-governance.yml",
        "examples/v6/tasks/TASK-01K0W4Z36K3W5C2R0A3M8N9P7Q-refund-auth/**",
        "tests/test_scope_and_git.py",
        "tests/test_migration_and_services.py",
        "tests/test_examples_v6.py",
        "tests/security/test_input_and_result_security.py",
        "tests/security/test_scope_threat_corpus.py"
      ],
      "depends_on": [],
      "expected_result": "tasks/TASK-01KXXHKS63XE2A30229824FX0N-v6-alpha-pilot-ready/results/RESULT-01KXXHTEMXPCT29MAV3AFAMWFJ.json",
      "id": "WU-01KXXHTEMXPCT29MAV3AFAMWFH",
      "owner": "security",
      "schema_version": 1,
      "status": "running",
      "task_id": "TASK-01KXXHKS63XE2A30229824FX0N-v6-alpha-pilot-ready",
      "title": "Path/YAML/Git 安全、迁移与权威示例"
    },
    "work_unit_id": "WU-01KXXHTEMXPCT29MAV3AFAMWFH"
  },
  "run_id": null,
  "schema_version": 1,
  "task_id": "TASK-01KXXHKS63XE2A30229824FX0N-v6-alpha-pilot-ready"
}
