{
  "actor": {
    "id": "devex-impl-r6",
    "kind": "agent"
  },
  "event_id": "EVT-01KXXN9N68Q66Z8XTFF31TS7VM",
  "event_type": "result_submitted",
  "expected_revision": 22,
  "idempotency_key": "result-devex-wu-v1",
  "new_revision": 23,
  "occurred_at": "2026-07-19T17:03:04.904218Z",
  "payload": {
    "digest": "sha256:e0f2e32c4dbbd3e174fb425283942782482fe09fcbaab2f7b5806c0d2380d2cf",
    "intake_proof": null,
    "outcome": "succeeded",
    "result": {
      "assumptions": [
        "Linux and privileged Windows CI will exercise the real directory and file symlink fixtures during Pilot."
      ],
      "blockers": [],
      "changed_files": [
        ".github/workflows/ci.yml",
        ".github/workflows/governance-pr.yml",
        ".github/workflows/release.yml",
        "pyproject.toml",
        "scripts/release/check_schema_lock.py",
        "src/mac/doctor.py",
        "src/mac/report.py",
        "src/mac/schema_validation.py",
        "tests/adapters/test_plain_terminal.py",
        "tests/operations/test_doctor.py",
        "tests/operations/test_governance_pr.py",
        "tests/operations/test_release_artifacts.py",
        "tests/reporting/test_audit_bundle.py",
        "tests/test_schema_validation.py"
      ],
      "commands": [
        {
          "argv": [
            "pytest",
            "devex-targeted"
          ],
          "exit_code": 0,
          "summary": "42 passed, 2 skipped"
        },
        {
          "argv": [
            "python",
            "scripts/release/check_schema_lock.py"
          ],
          "exit_code": 0,
          "summary": "schema bundle matches lock"
        },
        {
          "argv": [
            "python",
            "-m",
            "build",
            "--no-isolation"
          ],
          "exit_code": 0,
          "summary": "wheel and sdist post-build checks passed"
        },
        {
          "argv": [
            "git",
            "diff",
            "--check"
          ],
          "exit_code": 0,
          "summary": "clean; CRLF notices only"
        }
      ],
      "id": "RESULT-01KXXHTR2PNYB2M57BQTRFXC2B",
      "new_risks": [
        "Two real symlink fixtures are skipped on this Windows host because symlink creation is unavailable."
      ],
      "outcome": "succeeded",
      "run_id": "RUN-01KXXHVTRV1J0RFJZC931C47V2",
      "schema_version": 1,
      "scope_amendment_request": null,
      "submitted_at": "2026-07-19T16:50:00Z",
      "summary": "Hardened Doctor repair plans, audit bundle trust and resource limits, canonical schema locking, build hooks, and CI/release gates; closed pre-review resource and symlink findings.",
      "task_id": "TASK-01KXXHKS63XE2A30229824FX0N-v6-alpha-pilot-ready",
      "work_unit_id": "WU-01KXXHTR2PNYB2M57BQTRFXC2A"
    },
    "result_id": "RESULT-01KXXHTR2PNYB2M57BQTRFXC2B",
    "run": {
      "actor": {
        "id": "devex-implementer",
        "kind": "agent"
      },
      "exit_code": 0,
      "finished_at": "2026-07-19T16:50:00Z",
      "id": "RUN-01KXXHVTRV1J0RFJZC931C47V2",
      "independence_level": "L0",
      "runtime": {
        "execution_context_id": "devex-blocker-impl-20260719",
        "profile": "local-multi"
      },
      "schema_version": 1,
      "started_at": "2026-07-19T16:03:06.139424Z",
      "status": "succeeded",
      "task_id": "TASK-01KXXHKS63XE2A30229824FX0N-v6-alpha-pilot-ready",
      "work_unit_id": "WU-01KXXHTR2PNYB2M57BQTRFXC2A"
    },
    "work_unit": {
      "acceptance_criteria": [],
      "allowed_paths": [
        "src/mac/doctor.py",
        "src/mac/report.py",
        "src/mac/schema_validation.py",
        "src/mac/adapters/runtime/plain_terminal.py",
        "scripts/ci/governance_pr.py",
        "scripts/release/check_release_version.py",
        "scripts/release/check_schema_lock.py",
        ".github/workflows/ci.yml",
        ".github/workflows/governance-pr.yml",
        ".github/workflows/release.yml",
        "pyproject.toml",
        "tests/test_schema_validation.py",
        "tests/adapters/test_plain_terminal.py",
        "tests/operations/test_doctor.py",
        "tests/operations/test_governance_pr.py",
        "tests/operations/test_release_artifacts.py",
        "tests/reporting/test_audit_bundle.py"
      ],
      "depends_on": [],
      "expected_result": "tasks/TASK-01KXXHKS63XE2A30229824FX0N-v6-alpha-pilot-ready/results/RESULT-01KXXHTR2PNYB2M57BQTRFXC2B.json",
      "id": "WU-01KXXHTR2PNYB2M57BQTRFXC2A",
      "owner": "devex",
      "schema_version": 1,
      "status": "completed",
      "task_id": "TASK-01KXXHKS63XE2A30229824FX0N-v6-alpha-pilot-ready",
      "title": "Doctor、Audit、Schema-lock 与发布/CI 加固"
    },
    "work_unit_id": "WU-01KXXHTR2PNYB2M57BQTRFXC2A"
  },
  "run_id": "RUN-01KXXHVTRV1J0RFJZC931C47V2",
  "schema_version": 1,
  "task_id": "TASK-01KXXHKS63XE2A30229824FX0N-v6-alpha-pilot-ready"
}
