{
  "actor": {
    "id": "platform-impl-r6",
    "kind": "human"
  },
  "event_id": "EVT-01KXXNFJSKR04NSJCZTS24ZXGY",
  "event_type": "run_started",
  "expected_revision": 27,
  "idempotency_key": "integration-run-register-v1",
  "new_revision": 28,
  "occurred_at": "2026-07-19T17:06:19.059323Z",
  "payload": {
    "run": {
      "actor": {
        "id": "platform-impl-r6",
        "kind": "agent"
      },
      "exit_code": null,
      "finished_at": null,
      "id": "RUN-01KXXNFJP8QRTACVMQJ10M2TX6",
      "independence_level": "L0",
      "runtime": {
        "execution_context_id": "integration-cli-20260719",
        "profile": "local-multi"
      },
      "schema_version": 1,
      "started_at": "2026-07-19T17:06:18.952169Z",
      "status": "running",
      "task_id": "TASK-01KXXHKS63XE2A30229824FX0N-v6-alpha-pilot-ready",
      "work_unit_id": "WU-01KXXHV2CF6FRH4Z108JB3N4PA"
    },
    "run_id": "RUN-01KXXNFJP8QRTACVMQJ10M2TX6",
    "work_unit": {
      "acceptance_criteria": [],
      "allowed_paths": [
        "src/mac/cli.py",
        "docs/pilot/alpha-close-report.md",
        "tasks/TASK-01KXXHKS63XE2A30229824FX0N-v6-alpha-pilot-ready/**",
        "tasks/private/TASK-01KXXHKS63XE2A30229824FX0N-v6-alpha-pilot-ready/**",
        "tests/test_repair_round3.py",
        "tests/test_repair_round4.py",
        "tests/test_cli_integration.py",
        "tests/security/test_authority_commands.py"
      ],
      "depends_on": [
        "WU-01KXXHSZRPJ5YKMQ9MCQHQZH11",
        "WU-01KXXHTEMXPCT29MAV3AFAMWFH",
        "WU-01KXXHTR2PNYB2M57BQTRFXC2A"
      ],
      "expected_result": "tasks/TASK-01KXXHKS63XE2A30229824FX0N-v6-alpha-pilot-ready/results/RESULT-01KXXHV2CF6FRH4Z108JB3N4PB.json",
      "id": "WU-01KXXHV2CF6FRH4Z108JB3N4PA",
      "owner": "platform",
      "schema_version": 1,
      "status": "running",
      "task_id": "TASK-01KXXHKS63XE2A30229824FX0N-v6-alpha-pilot-ready",
      "title": "CLI 集成、全链路验证与 Pilot-ready 报告"
    },
    "work_unit_id": "WU-01KXXHV2CF6FRH4Z108JB3N4PA"
  },
  "run_id": null,
  "schema_version": 1,
  "task_id": "TASK-01KXXHKS63XE2A30229824FX0N-v6-alpha-pilot-ready"
}
