{
  "schema_version": 1,
  "event_id": "EVT-01K0W4Z36K3W5C2R0A3M8N9P83",
  "task_id": "TASK-01K0W4Z36K3W5C2R0A3M8N9P7Q-refund-auth",
  "event_type": "scope_approved",
  "occurred_at": "2026-07-17T10:02:00Z",
  "actor": {
    "id": "human-security-owner",
    "kind": "human"
  },
  "run_id": null,
  "expected_revision": 1,
  "new_revision": 2,
  "idempotency_key": "example-2",
  "payload": {
    "scope_id": "SCOPE-01K0W4Z36K3W5C2R0A3M8N9P7R",
    "approval_id": "APR-01K0W4Z36K3W5C2R0A3M8N9P80"
  }
}
